<?xml version="1.0" encoding="UTF-8"?>
<!--
 This section contains information about the syntax of the XML part of this file
 and which attributes that are valid for each tag. Below is a listing of all 
 valid tags and the use of them. See the layout.info file for the formal schema
 definition that this file must conform to.
  
 <documenttitle> 
 ===============
 Description: There can only be one instance of this tag and it shall be placed
              as a child to the <document> tag.
 
 Tag value  : The value of this tag will be put as title in the web browser. 
             
 Attributes : There are no attributes which are valid for this tag.
 
 
 <row>
 =====
 Description: There can only be one start and stop instance of this tag and it
              shall be placed as a child to the <document> tag.
 
 Tag value  : No value for this tag. 
 
 Attributes : The class attribute is optional and used by the CSS. This is the
              only valid attribute for this tag.
 
 
 <column>
 ========
 Description: There can only be one start and stop instance of this tag and it
              shall be placed as a child to the <row> tag.
 
 Tag value  : No value for this tag.
   
 Attributes : class and amount are the two attributes that are valid for this 
              tag. The class attribute is optional, and used by the CSS. The
              amount attribute is mandatory and shall contain an integer value
              larger than zero. This attribute defines how many columns of 
              images that will be generated in the thumb nail overview.  
            
            
 <image/>
 ========
 Description: There can only be one instance of this tag and it shall be placed 
              as a child to the <column> tag.
 
 Tag value  : No value for this tag.
   
 Attributes : The class attribute is optional and used by the CSS. This is the
              only valid attribute for this tag.


 <meta>
 ======
 Description: There can only be one start and stop instance of this tag and it
              shall be placed as a child to the <column> tag.
 
 Tag value  : No value for this tag.
 
 Attributes : The class attribute is optional and used by the CSS. This is the
              only valid attribute for this tag.


<metaitem/>
===========
 Description: There can be several instances of this tag and they shall all be 
              placed as children to the <meta> tag.
 
 Tag value  : No value for this tag.
   
 Attributes : class, label and meta are the attributes that are valid for this 
              tag. The class attribute is optional, and used by the CSS. The
              label attribute is mandatory and shall contain a string value that
              will be a label for the meta data value that will be defined by 
              the last attribute, meta.
             
              Available values for the meta attribute are:
             
              "fileName"
              "date"
              "time"
              "cameraModel"
              "exposureTime"
              "isoValue"
              "pictureWidth"
              "pictureHeight"
              "apertureValue"
              "fileSize"
  -->
<document xmlns="http://moller.javapeg.layout.com" xmlns:xsi="http://www.w3.org/2001/XMLSchema-instance" xsi:schemaLocation="http://moller.javapeg.layout.com layout.xsd">
  <documenttitle>Image overview</documenttitle>
  <row class="row">
    <column class="column" amount="5">
      <image class="image" />
      <meta class="meta">
        <metaitem class="metaitem" label="File size:" meta="fileSize" />
        <metaitem class="metaitem" label="Date:" meta="date" />
        <metaitem class="metaitem" label="Time:" meta="time" />
      </meta>
    </column>
  </row>
</document>